{
  "bundle_id": "sha256:a584270a3168b27f0bf6cf39b9ea566820037880808a783ef56a82cbc70c3f57",
  "claim_predicate": "barrier_mae_mev<=40",
  "epistemic_status": "negative",
  "evidence_refs": [
    {
      "artifact": "data/candidates/z1/raw/mace-mp-medium/cell_result.json",
      "artifact_hash": "sha256:609414ccf65db50ae40e77205963b945b71ceb696de1d658d9f9d9961c2222f7",
      "campaign": "discovery.round-4.z1-barriers.v1",
      "campaign_manifest": "campaigns/v1/z1.campaign-manifest.v1.json",
      "campaign_manifest_hash": "sha256:579d72125c53597750cc6ee9ce01e87ce1a0d3dda5e5a6fe72009abc62d943f6",
      "run_id": "z1-campaign-mace-mp-medium",
      "thresholds_version": "hard-materials-z1.v1"
    }
  ],
  "measurements": [
    {
      "acceptance_test": {
        "comparator": "less_than_or_equal",
        "outcome": "fail",
        "threshold": 40
      },
      "metric": "barrier_mae",
      "sample_count": 29,
      "unit": "meV",
      "value": 174.7392625242481
    }
  ],
  "provenance": {
    "agent": "gcp/mlip-cell-runner/z1_barrier.py",
    "human": "Alex Welcing (director)",
    "preregistration_id": "prereg.discovery.round-4.z1.2026-07-18",
    "timestamp": "2026-07-19T21:30:58Z"
  },
  "scope": {
    "chemistries": [
      "Ag-F-Li",
      "Al-B-Li-O",
      "Al-Co-Li-O",
      "Al-Li-Mn-O",
      "Al-Li-O-Si",
      "Al-Li-O-V",
      "As-B-Cr-Li-O",
      "As-C-Fe-Li-O",
      "B-Bi-Li-O",
      "B-Co-Li-O",
      "B-Li-Ni-O",
      "B-Li-O",
      "B-Li-O-Sn",
      "B-Li-O-Ti",
      "B-Li-O-Zn",
      "Bi-Li-S",
      "C-Co-Li-Na-O-P",
      "C-Cr-Li-O",
      "C-Cu-Li-O",
      "C-Fe-Li-Na-O-P",
      "C-Fe-Li-O",
      "C-Fe-Li-O-P",
      "C-Fe-Li-O-S",
      "C-Li-Mn-O",
      "C-Li-Mn-O-P-V",
      "C-Li-O-P-V",
      "C-Li-O-Si-V",
      "C-Li-O-V",
      "Ca-Li-N-Si",
      "Cl-Cr-Li"
    ],
    "conditions": {
      "acceptance_threshold_mev": 40,
      "barrier_energy_unit": "eV",
      "barrier_mae_mev": 174.7392625242481,
      "candidate_panel_sha256": "sha256:192fe54a5579cc421f6644d5d76fb442c6dfb985f014dc4741549e29052efb68",
      "completed_path_count": 29,
      "failed_path_count": 1,
      "failed_path_ids": [
        "mp-756912_1_1_1_0_0"
      ],
      "failure_policy": "record failure without imputation",
      "measurement_complete": false,
      "model_artifact_hash": "sha256:1d80b5c4898b2d22d73dc82b17e1cabe1111d9cd6be4c2a7403dea6fa0ac83f3",
      "model_id": "mace-mp-medium",
      "model_version": "mace-torch 0.3.16 / medium",
      "outcome": "fail",
      "path_count": 30,
      "reference_kind": "published DFT-NEB",
      "signed_error_unit": "meV",
      "signed_underestimate_count": 21,
      "signed_underestimate_fraction": 0.7241379310344828
    },
    "properties": [
      "migration_barrier"
    ],
    "structures": [
      "mp-1020056",
      "mp-1222404",
      "mp-1222469",
      "mp-1222591",
      "mp-1295192",
      "mp-25463",
      "mp-3635",
      "mp-556655",
      "mp-567474",
      "mp-752552",
      "mp-752707",
      "mp-753882",
      "mp-753899",
      "mp-754292",
      "mp-754923",
      "mp-756912",
      "mp-757800",
      "mp-758282",
      "mp-759667",
      "mp-760344",
      "mp-761269",
      "mp-768508",
      "mp-768738",
      "mp-770551",
      "mp-770749",
      "mp-770876",
      "mp-770939",
      "mp-771011",
      "mp-772542",
      "mp-772851"
    ]
  },
  "supersedes": []
}
