{
  "bundle_id": "sha256:a7c3f472d9774ae49fe48b6562e8eccf394db5ed2f40134d9c4e596268e0aaa5",
  "claim_predicate": "adsorption_energy_mae<=0.1",
  "epistemic_status": "negative",
  "evidence_refs": [
    {
      "artifact": "data/candidates/z3/delta-correction-report.json",
      "artifact_hash": "sha256:95c4fd245fa3e14ca80ff85fff235ce8f58f43dffce996fbf9bd3254adbf838f",
      "campaign": "discovery.round-4.z3-adsorption.v1",
      "campaign_manifest": "campaigns/v1/z3.campaign-manifest.v1.json",
      "campaign_manifest_hash": "sha256:2b624c9258e0d6ec0a22cb936bf5d63de592a171b0dc8aa99573f66906006f43",
      "run_id": "z3-20260719",
      "thresholds_version": "hard-materials-z3.v1"
    }
  ],
  "provenance": {
    "agent": "gcp/z3-campaign/run_measurement.py",
    "human": "Alex Welcing (director)",
    "preregistration_id": "prereg.discovery.round-4.z3.2026-07-18",
    "timestamp": "2026-07-20T01:25:57.927167+00:00"
  },
  "scope": {
    "chemistries": [
      "biomass_ni_mol1:mol1gas",
      "biomass_ni_mol1:mol1star",
      "biomass_ni_mol1:star",
      "biomass_ni_mol2:mol2gas",
      "biomass_ni_mol2:mol2star",
      "biomass_ni_mol2:star",
      "biomass_ni_mol3:mol3gas",
      "biomass_ni_mol3:mol3star",
      "biomass_ni_mol3:star",
      "biomass_ni_mol4:mol4gas",
      "biomass_ni_mol4:mol4star",
      "biomass_ni_mol4:star",
      "biomass_ru_mol1:mol1gas",
      "biomass_ru_mol1:mol1star",
      "biomass_ru_mol1:star",
      "biomass_ru_mol4:mol4gas",
      "biomass_ru_mol4:mol4star",
      "biomass_ru_mol4:star",
      "plastics_pt_PE:PEgas",
      "plastics_pt_PE:PEstar",
      "plastics_pt_PE:star",
      "plastics_pt_PET:PETgas",
      "plastics_pt_PET:PETstar",
      "plastics_pt_PET:star",
      "plastics_pt_PPit:PPitgas",
      "plastics_pt_PPit:PPitstar",
      "plastics_pt_PPit:star",
      "polyurethanes_ag_mol16:mol16gas",
      "polyurethanes_ag_mol16:mol16star",
      "polyurethanes_ag_mol16:star",
      "polyurethanes_ag_mol17:mol17gas",
      "polyurethanes_ag_mol17:mol17star",
      "polyurethanes_ag_mol17:star",
      "polyurethanes_ag_mol18:mol18gas",
      "polyurethanes_ag_mol18:mol18star",
      "polyurethanes_ag_mol18:star",
      "polyurethanes_ag_mol19:mol19gas",
      "polyurethanes_ag_mol19:mol19star",
      "polyurethanes_ag_mol19:star",
      "polyurethanes_ag_mol41:mol41gas",
      "polyurethanes_ag_mol41:mol41star",
      "polyurethanes_ag_mol41:star",
      "polyurethanes_au_mol16:mol16gas",
      "polyurethanes_au_mol16:mol16star",
      "polyurethanes_au_mol16:star",
      "polyurethanes_au_mol17:mol17gas",
      "polyurethanes_au_mol17:mol17star",
      "polyurethanes_au_mol17:star",
      "polyurethanes_cu_mol16:mol16gas",
      "polyurethanes_cu_mol16:mol16star",
      "polyurethanes_cu_mol16:star",
      "polyurethanes_cu_mol18:mol18gas",
      "polyurethanes_cu_mol18:mol18star",
      "polyurethanes_cu_mol18:star",
      "polyurethanes_cu_mol19:mol19gas",
      "polyurethanes_cu_mol19:mol19star",
      "polyurethanes_cu_mol19:star",
      "polyurethanes_cu_mol41:mol41gas",
      "polyurethanes_cu_mol41:mol41star",
      "polyurethanes_cu_mol41:star"
    ],
    "conditions": {
      "acceptance_comparator": "less_than_or_equal",
      "acceptance_threshold_ev": 0.1,
      "baseline_holdout_mae_ev": 0.6870841794971009,
      "corrected_holdout_mae_ev": 2.271904728260539,
      "correction_status": "executed_no_holdout_leakage",
      "fit_exclusion": "delta_train fit; delta_validation selection; confirmatory_test scoring only",
      "model_id": "chgnet",
      "outcome": "fail",
      "reference_kind": "published DFT electronic energy at 0 K",
      "sample_count": 20,
      "selected_correction_form": "C_family_linear",
      "unit": "eV"
    },
    "properties": [
      "adsorption_energy"
    ],
    "structures": [
      "biomass_ni_mol1",
      "biomass_ni_mol2",
      "biomass_ni_mol3",
      "biomass_ni_mol4",
      "biomass_ru_mol1",
      "biomass_ru_mol4",
      "plastics_pt_PE",
      "plastics_pt_PET",
      "plastics_pt_PPit",
      "polyurethanes_ag_mol16",
      "polyurethanes_ag_mol17",
      "polyurethanes_ag_mol18",
      "polyurethanes_ag_mol19",
      "polyurethanes_ag_mol41",
      "polyurethanes_au_mol16",
      "polyurethanes_au_mol17",
      "polyurethanes_cu_mol16",
      "polyurethanes_cu_mol18",
      "polyurethanes_cu_mol19",
      "polyurethanes_cu_mol41"
    ]
  },
  "supersedes": []
}
